{
  "$schema": "https://json-schema.org/draft/2020-12/schema",
  "$id": "https://autophagy.sh/specs/mutation/0.2/schema.json",
  "title": "Autophagy Mutation Package v0.2",
  "description": "Mutation Package v0.1 plus an optional model-synthesis provenance block. A v0.2 package with no provenance is a v0.1 package; the shapes are otherwise identical. Provenance records the provider and model that enriched the reviewable content and never carries secrets, endpoints, prompts, or raw payloads.",
  "type": "object",
  "additionalProperties": false,
  "required": [
    "spec_version", "mutation_id", "version", "state", "generated_by",
    "source_finding_id", "source_detector", "title", "hypothesis",
    "triggers", "exclusions", "intervention", "permissions", "promotion",
    "provenance"
  ],
  "properties": {
    "spec_version": { "const": "mutation/0.2" },
    "mutation_id": { "type": "string", "pattern": "^mut_[A-Za-z0-9._:-]{1,127}$" },
    "version": { "type": "string", "pattern": "^[0-9]+\\.[0-9]+\\.[0-9]+(?:[-+][0-9A-Za-z.-]+)?$" },
    "state": { "const": "candidate" },
    "generated_by": { "const": "model_synthesis_v1" },
    "source_finding_id": { "type": "string", "pattern": "^fnd_[A-Za-z0-9._:-]{1,127}$" },
    "source_detector": {
      "enum": [
        "repeated_command_failure",
        "repeated_user_correction",
        "repeated_successful_recovery"
      ]
    },
    "title": { "type": "string", "minLength": 1 },
    "hypothesis": { "$ref": "#/$defs/hypothesis" },
    "triggers": {
      "type": "array",
      "minItems": 1,
      "items": { "$ref": "#/$defs/trigger" }
    },
    "exclusions": { "type": "array", "items": { "type": "string", "minLength": 1 } },
    "intervention": {
      "type": "object",
      "additionalProperties": false,
      "required": ["type", "instruction"],
      "properties": {
        "type": { "const": "agent_instruction" },
        "instruction": { "type": "string", "minLength": 1 }
      }
    },
    "permissions": { "$ref": "#/$defs/permissions" },
    "promotion": { "$ref": "#/$defs/promotion" },
    "provenance": { "$ref": "#/$defs/provenance" }
  },
  "$defs": {
    "hypothesis": {
      "type": "object",
      "additionalProperties": false,
      "required": ["statement", "expected_result", "supporting_event_ids", "counterexample_event_ids", "failure_cases"],
      "properties": {
        "statement": { "type": "string", "minLength": 1 },
        "expected_result": { "type": "string", "minLength": 1 },
        "supporting_event_ids": {
          "type": "array", "minItems": 2, "uniqueItems": true,
          "items": { "type": "string", "pattern": "^evt_[A-Za-z0-9._:-]{1,127}$" }
        },
        "counterexample_event_ids": {
          "type": "array", "uniqueItems": true,
          "items": { "type": "string", "pattern": "^evt_[A-Za-z0-9._:-]{1,127}$" }
        },
        "failure_cases": { "type": "array", "minItems": 1, "items": { "type": "string", "minLength": 1 } }
      }
    },
    "trigger": {
      "type": "object",
      "additionalProperties": false,
      "required": ["type", "selector"],
      "properties": {
        "type": { "enum": ["tool_call", "agent_decision"] },
        "selector": { "type": "string", "minLength": 1 }
      }
    },
    "permissions": {
      "type": "object",
      "additionalProperties": false,
      "required": ["filesystem_read", "filesystem_write", "commands", "environment", "network"],
      "properties": {
        "filesystem_read": { "type": "array", "maxItems": 0 },
        "filesystem_write": { "type": "array", "maxItems": 0 },
        "commands": { "type": "array", "maxItems": 0 },
        "environment": { "type": "array", "maxItems": 0 },
        "network": { "const": false }
      }
    },
    "promotion": {
      "type": "object",
      "additionalProperties": false,
      "required": ["minimum_replays", "minimum_success_rate_bps", "maximum_false_positive_rate_bps"],
      "properties": {
        "minimum_replays": { "type": "integer", "minimum": 1 },
        "minimum_success_rate_bps": { "type": "integer", "minimum": 0, "maximum": 10000 },
        "maximum_false_positive_rate_bps": { "type": "integer", "minimum": 0, "maximum": 10000 }
      }
    },
    "provenance": {
      "type": "object",
      "additionalProperties": false,
      "required": ["provider", "model_name", "model_revision", "manifest_spec_version"],
      "properties": {
        "provider": { "type": "string", "minLength": 1 },
        "model_name": { "type": "string", "minLength": 1 },
        "model_revision": { "type": "string", "minLength": 1 },
        "model_digest": { "type": "string", "minLength": 1 },
        "manifest_spec_version": { "type": "string", "minLength": 1 }
      }
    }
  }
}
